{
  "job_id": "job-generic-001",
  "host": "internal",
  "adapter": "generic",
  "payload": {
    "host": {
      "type": "cli",
      "host_task_id": "bridge-generic-001",
      "source_agent": null,
      "callback": {}
    },
    "role_binding": {
      "role_id": "general",
      "risk_mode": "balanced",
      "privacy_mode": "local_only",
      "output_profiles": ["markdown"]
    },
    "task_request": {
      "task_id": "bridge-generic-001",
      "title": "Bridge demo",
      "instruction": "Explain what a tree data structure is and where it is used.",
      "inputs": {},
      "constraints": {
        "max_words": 120
      },
      "priority": "P2",
      "budget": {
        "quality_level": "B1"
      },
      "expected_outputs": ["markdown_response"]
    },
    "runtime_hints": {}
  },
  "runtime": {
    "backend": "offline",
    "verifier": "rule_based"
  }
}
